{
  "version": "smerc.evidence-program.v1",
  "program_id": "smerc-core-validation-v1",
  "title": "SMERC Core Product, Safety, and Commercial Assumptions",
  "claims": [
    {
      "claim_id": "TECH-001",
      "statement": "Irreversible exposure scores are positively associated with consequential incident severity.",
      "unknown_class": "epistemic",
      "risk_level": "critical",
      "owner_role": "validation-lead",
      "failure_consequence": "The central scoring mechanism would not demonstrate operational risk discrimination.",
      "criteria": [{"criterion_id": "TECH-001-C1", "metric": "severity_spearman_correlation", "operator": "gte", "threshold": 0.35, "minimum_sample_size": 100, "minimum_source_quality": 0.7, "required_segments": ["software_development", "cloud_administration", "finance_operations"]}]
    },
    {
      "claim_id": "SAFE-001",
      "statement": "Candidate releases classified as acceptable do not create an intolerable false-release rate.",
      "unknown_class": "operational",
      "risk_level": "critical",
      "owner_role": "security-validation-lead",
      "failure_consequence": "SMERC could release actions that qualified reviewers consider unsafe.",
      "criteria": [{"criterion_id": "SAFE-001-C1", "metric": "false_release_rate", "operator": "lte", "threshold": 0.02, "minimum_sample_size": 200, "minimum_source_quality": 0.8, "required_segments": ["high_impact_actions"]}]
    },
    {
      "claim_id": "ADVR-001",
      "statement": "Agents cannot routinely gain a less restrictive posture by manipulating descriptive metadata.",
      "unknown_class": "adversarial",
      "risk_level": "critical",
      "owner_role": "red-team-lead",
      "failure_consequence": "The permission boundary could be bypassed through action-envelope manipulation.",
      "criteria": [{"criterion_id": "ADVR-001-C1", "metric": "metadata_evasion_success_rate", "operator": "lte", "threshold": 0.05, "minimum_sample_size": 200, "minimum_source_quality": 0.8, "required_segments": ["semantic_rewrite", "signal_omission", "authority_spoofing"]}]
    },
    {
      "claim_id": "HUMN-001",
      "statement": "Qualified reviewers agree with SMERC postures often enough to support recommendation-mode use.",
      "unknown_class": "normative",
      "risk_level": "high",
      "owner_role": "pilot-review-lead",
      "failure_consequence": "SMERC recommendations would create disputes rather than useful governance evidence.",
      "criteria": [{"criterion_id": "HUMN-001-C1", "metric": "reviewer_agreement_rate", "operator": "gte", "threshold": 0.75, "minimum_sample_size": 100, "minimum_source_quality": 0.7, "required_segments": ["security", "platform_engineering"]}]
    },
    {
      "claim_id": "INTG-001",
      "statement": "Enforcement adapters faithfully apply the controls returned by the decision language.",
      "unknown_class": "operational",
      "risk_level": "high",
      "owner_role": "integration-owner",
      "failure_consequence": "A correct decision could fail to constrain the real action.",
      "criteria": [{"criterion_id": "INTG-001-C1", "metric": "control_enforcement_fidelity", "operator": "gte", "threshold": 0.98, "minimum_sample_size": 500, "minimum_source_quality": 0.8, "required_segments": ["allow", "throttle", "freeze", "deny", "escalate"]}]
    },
    {
      "claim_id": "AUTH-001",
      "statement": "High-impact action requests carry verifiable authority provenance rather than self-asserted confidence alone.",
      "unknown_class": "regulatory",
      "risk_level": "high",
      "owner_role": "identity-and-access-owner",
      "failure_consequence": "The system could mistake claimed authority for accountable authorization.",
      "criteria": [{"criterion_id": "AUTH-001-C1", "metric": "verified_authority_coverage", "operator": "gte", "threshold": 0.99, "minimum_sample_size": 200, "minimum_source_quality": 0.9, "required_segments": ["high_impact_actions"]}]
    },
    {
      "claim_id": "PERF-001",
      "statement": "Pre-execution evaluation latency remains acceptable for the selected workflow class.",
      "unknown_class": "operational",
      "risk_level": "moderate",
      "owner_role": "platform-owner",
      "failure_consequence": "Teams could bypass or remove SMERC because it delays normal operations.",
      "criteria": [{"criterion_id": "PERF-001-C1", "metric": "evaluation_latency_p95_ms", "operator": "lte", "threshold": 250, "minimum_sample_size": 1000, "minimum_source_quality": 0.7, "required_segments": ["github_actions"]}]
    },
    {
      "claim_id": "COMM-001",
      "statement": "Qualified design partners will pay to continue after an evidence-producing pilot.",
      "unknown_class": "commercial",
      "risk_level": "moderate",
      "owner_role": "commercial-owner",
      "failure_consequence": "Technical interest would not translate into a repeatable business.",
      "criteria": [{"criterion_id": "COMM-001-C1", "metric": "paid_continuation_rate", "operator": "gte", "threshold": 0.2, "minimum_sample_size": 10, "minimum_source_quality": 0.7, "required_segments": []}]
    }
  ]
}
